Enter password: *****
Welcome to the MySQL monitor.  Commands end with ; or \g.
Your MySQL connection id is 12
Server version: 8.0.44 MySQL Community Server - GPL

Copyright (c) 2000, 2025, Oracle and/or its affiliates.

Oracle is a registered trademark of Oracle Corporation and/or its
affiliates. Other names may be trademarks of their respective
owners.

Type 'help;' or '\h' for help. Type '\c' to clear the current input statement.

mysql> -- ==============================
mysql> -- EMP APPRAISAL DATABASE PROJECT
mysql> -- ==============================
mysql>
mysql> -- 1. CREATE DATABASE
mysql> CREATE DATABASE EmpAppraisalDB;
Query OK, 1 row affected (0.01 sec)

mysql> USE EmpAppraisalDB;
Database changed
mysql>
mysql> -- ==============================
mysql> -- 2. TABLE CREATION (DDL)
mysql> -- ==============================
mysql>
mysql> -- Employee Table
mysql> CREATE TABLE Employee (
    ->     emp_id INT PRIMARY KEY,
    ->     emp_name VARCHAR(50) NOT NULL,
    ->     department VARCHAR(30),
    ->     designation VARCHAR(30),
    ->     join_date DATE,
    ->     salary DECIMAL(10,2),
    ->     email VARCHAR(100) UNIQUE,
    ->     age INT CHECK (age >= 18)
    -> );
Query OK, 0 rows affected (0.01 sec)

mysql>
mysql> -- Appraisal Table
mysql> CREATE TABLE Appraisal (
    ->     appraisal_id INT PRIMARY KEY,
    ->     emp_id INT,
    ->     appraisal_year INT,
    ->     rating INT CHECK (rating BETWEEN 1 AND 5),
    ->     bonus DECIMAL(10,2),
    ->     remarks VARCHAR(100),
    ->     FOREIGN KEY (emp_id) REFERENCES Employee(emp_id)
    -> );
Query OK, 0 rows affected (0.01 sec)

mysql>
mysql> -- Department Table
mysql> CREATE TABLE Department (
    ->     dept_id INT PRIMARY KEY,
    ->     dept_name VARCHAR(30) UNIQUE,
    ->     location VARCHAR(50)
    -> );
Query OK, 0 rows affected (0.01 sec)

mysql>
mysql> -- ==============================
mysql> -- 3. INDEX CREATION
mysql> -- ==============================
mysql>
mysql> CREATE INDEX idx_emp_name ON Employee(emp_name);
Query OK, 0 rows affected (0.02 sec)
Records: 0  Duplicates: 0  Warnings: 0

mysql> CREATE INDEX idx_appraisal_year ON Appraisal(appraisal_year);
Query OK, 0 rows affected (0.01 sec)
Records: 0  Duplicates: 0  Warnings: 0

mysql>
mysql> -- ==============================
mysql> -- 4. INSERT DATA
mysql> -- ==============================
mysql>
mysql> INSERT INTO Employee VALUES
    -> (1, 'Amit Sharma', 'IT', 'Developer', '2020-06-15', 60000, 'amit@gmail.com', 28),
    -> (2, 'Priya Singh', 'HR', 'Manager', '2018-03-10', 75000, 'priya@gmail.com', 32),
    -> (3, 'Rahul Verma', 'IT', 'Tester', '2021-01-20', 45000, 'rahul@gmail.com', 26),
    -> (4, 'Sneha Patil', 'Finance', 'Analyst', '2019-07-25', 70000, 'sneha@gmail.com', 30),
    -> (5, 'Vikram Rao', 'IT', 'Developer', '2022-09-12', 50000, 'vikram@gmail.com', 25);
Query OK, 5 rows affected (0.00 sec)
Records: 5  Duplicates: 0  Warnings: 0

mysql>
mysql> INSERT INTO Appraisal VALUES
    -> (101, 1, 2023, 4, 5000, 'Good Performance'),
    -> (102, 2, 2023, 5, 10000, 'Excellent Leadership'),
    -> (103, 3, 2023, 3, 2000, 'Average'),
    -> (104, 4, 2023, 4, 6000, 'Good'),
    -> (105, 5, 2023, 2, 1000, 'Needs Improvement');
Query OK, 5 rows affected (0.00 sec)
Records: 5  Duplicates: 0  Warnings: 0

mysql>
mysql> INSERT INTO Department VALUES
    -> (10, 'IT', 'Mumbai'),
    -> (20, 'HR', 'Pune'),
    -> (30, 'Finance', 'Delhi');
Query OK, 3 rows affected (0.00 sec)
Records: 3  Duplicates: 0  Warnings: 0

mysql>
mysql> -- ==============================
mysql> -- 5. SQL QUERIES (DML - 15 IMPORTANT QUERIES)
mysql> -- ==============================
mysql>
mysql> -- 1. Select all employees
mysql> SELECT * FROM Employee;
+--------+-------------+------------+-------------+------------+----------+------------------+------+
| emp_id | emp_name    | department | designation | join_date  | salary   | email            | age  |
+--------+-------------+------------+-------------+------------+----------+------------------+------+
|      1 | Amit Sharma | IT         | Developer   | 2020-06-15 | 60000.00 | amit@gmail.com   |   28 |
|      2 | Priya Singh | HR         | Manager     | 2018-03-10 | 75000.00 | priya@gmail.com  |   32 |
|      3 | Rahul Verma | IT         | Tester      | 2021-01-20 | 45000.00 | rahul@gmail.com  |   26 |
|      4 | Sneha Patil | Finance    | Analyst     | 2019-07-25 | 70000.00 | sneha@gmail.com  |   30 |
|      5 | Vikram Rao  | IT         | Developer   | 2022-09-12 | 50000.00 | vikram@gmail.com |   25 |
+--------+-------------+------------+-------------+------------+----------+------------------+------+
5 rows in set (0.00 sec)

mysql>
mysql> -- 2. Salary greater than 50000
mysql> SELECT emp_name, salary
    -> FROM Employee
    -> WHERE salary > 50000;
+-------------+----------+
| emp_name    | salary   |
+-------------+----------+
| Amit Sharma | 60000.00 |
| Priya Singh | 75000.00 |
| Sneha Patil | 70000.00 |
+-------------+----------+
3 rows in set (0.00 sec)

mysql>
mysql> -- 3. IT department employees
mysql> SELECT * FROM Employee
    -> WHERE department = 'IT';
+--------+-------------+------------+-------------+------------+----------+------------------+------+
| emp_id | emp_name    | department | designation | join_date  | salary   | email            | age  |
+--------+-------------+------------+-------------+------------+----------+------------------+------+
|      1 | Amit Sharma | IT         | Developer   | 2020-06-15 | 60000.00 | amit@gmail.com   |   28 |
|      3 | Rahul Verma | IT         | Tester      | 2021-01-20 | 45000.00 | rahul@gmail.com  |   26 |
|      5 | Vikram Rao  | IT         | Developer   | 2022-09-12 | 50000.00 | vikram@gmail.com |   25 |
+--------+-------------+------------+-------------+------------+----------+------------------+------+
3 rows in set (0.00 sec)

mysql>
mysql> -- 4. Order by salary descending
mysql> SELECT * FROM Employee
    -> ORDER BY salary DESC;
+--------+-------------+------------+-------------+------------+----------+------------------+------+
| emp_id | emp_name    | department | designation | join_date  | salary   | email            | age  |
+--------+-------------+------------+-------------+------------+----------+------------------+------+
|      2 | Priya Singh | HR         | Manager     | 2018-03-10 | 75000.00 | priya@gmail.com  |   32 |
|      4 | Sneha Patil | Finance    | Analyst     | 2019-07-25 | 70000.00 | sneha@gmail.com  |   30 |
|      1 | Amit Sharma | IT         | Developer   | 2020-06-15 | 60000.00 | amit@gmail.com   |   28 |
|      5 | Vikram Rao  | IT         | Developer   | 2022-09-12 | 50000.00 | vikram@gmail.com |   25 |
|      3 | Rahul Verma | IT         | Tester      | 2021-01-20 | 45000.00 | rahul@gmail.com  |   26 |
+--------+-------------+------------+-------------+------------+----------+------------------+------+
5 rows in set (0.00 sec)

mysql>
mysql> -- 5. Update salary
mysql> UPDATE Employee
    -> SET salary = salary + 5000
    -> WHERE emp_id = 3;
Query OK, 1 row affected (0.00 sec)
Rows matched: 1  Changed: 1  Warnings: 0

mysql>
mysql> -- 6. Delete low rating appraisal
mysql> DELETE FROM Appraisal
    -> WHERE rating = 2;
Query OK, 1 row affected (0.00 sec)

mysql>
mysql> -- 7. Average salary
mysql> SELECT AVG(salary) AS average_salary
    -> FROM Employee;
+----------------+
| average_salary |
+----------------+
|   61000.000000 |
+----------------+
1 row in set (0.00 sec)

mysql>
mysql> -- 8. Count employees per department
mysql> SELECT department, COUNT(*) AS total_employees
    -> FROM Employee
    -> GROUP BY department;
+------------+-----------------+
| department | total_employees |
+------------+-----------------+
| IT         |               3 |
| HR         |               1 |
| Finance    |               1 |
+------------+-----------------+
3 rows in set (0.00 sec)

mysql>
mysql> -- 9. JOIN Employee + Appraisal
mysql> SELECT e.emp_name, e.department, a.rating, a.bonus
    -> FROM Employee e
    -> JOIN Appraisal a ON e.emp_id = a.emp_id;
+-------------+------------+--------+----------+
| emp_name    | department | rating | bonus    |
+-------------+------------+--------+----------+
| Amit Sharma | IT         |      4 |  5000.00 |
| Priya Singh | HR         |      5 | 10000.00 |
| Rahul Verma | IT         |      3 |  2000.00 |
| Sneha Patil | Finance    |      4 |  6000.00 |
+-------------+------------+--------+----------+
4 rows in set (0.00 sec)

mysql>
mysql> -- 10. Maximum bonus
mysql> SELECT MAX(bonus) AS highest_bonus
    -> FROM Appraisal;
+---------------+
| highest_bonus |
+---------------+
|      10000.00 |
+---------------+
1 row in set (0.00 sec)

mysql>
mysql> -- 11. UNION (IT + HR employees)
mysql> SELECT emp_name FROM Employee WHERE department = 'IT'
    -> UNION
    -> SELECT emp_name FROM Employee WHERE department = 'HR';
+-------------+
| emp_name    |
+-------------+
| Amit Sharma |
| Rahul Verma |
| Vikram Rao  |
| Priya Singh |
+-------------+
4 rows in set (0.00 sec)

mysql>
mysql> -- 12. BETWEEN operator
mysql> SELECT * FROM Employee
    -> WHERE salary BETWEEN 50000 AND 75000;
+--------+-------------+------------+-------------+------------+----------+------------------+------+
| emp_id | emp_name    | department | designation | join_date  | salary   | email            | age  |
+--------+-------------+------------+-------------+------------+----------+------------------+------+
|      1 | Amit Sharma | IT         | Developer   | 2020-06-15 | 60000.00 | amit@gmail.com   |   28 |
|      2 | Priya Singh | HR         | Manager     | 2018-03-10 | 75000.00 | priya@gmail.com  |   32 |
|      3 | Rahul Verma | IT         | Tester      | 2021-01-20 | 50000.00 | rahul@gmail.com  |   26 |
|      4 | Sneha Patil | Finance    | Analyst     | 2019-07-25 | 70000.00 | sneha@gmail.com  |   30 |
|      5 | Vikram Rao  | IT         | Developer   | 2022-09-12 | 50000.00 | vikram@gmail.com |   25 |
+--------+-------------+------------+-------------+------------+----------+------------------+------+
5 rows in set (0.00 sec)

mysql>
mysql> -- 13. IN operator
mysql> SELECT * FROM Employee
    -> WHERE department IN ('IT', 'Finance');
+--------+-------------+------------+-------------+------------+----------+------------------+------+
| emp_id | emp_name    | department | designation | join_date  | salary   | email            | age  |
+--------+-------------+------------+-------------+------------+----------+------------------+------+
|      1 | Amit Sharma | IT         | Developer   | 2020-06-15 | 60000.00 | amit@gmail.com   |   28 |
|      3 | Rahul Verma | IT         | Tester      | 2021-01-20 | 50000.00 | rahul@gmail.com  |   26 |
|      4 | Sneha Patil | Finance    | Analyst     | 2019-07-25 | 70000.00 | sneha@gmail.com  |   30 |
|      5 | Vikram Rao  | IT         | Developer   | 2022-09-12 | 50000.00 | vikram@gmail.com |   25 |
+--------+-------------+------------+-------------+------------+----------+------------------+------+
4 rows in set (0.00 sec)

mysql>
mysql> -- 14. LIKE operator
mysql> SELECT * FROM Employee
    -> WHERE emp_name LIKE 'S%';
+--------+-------------+------------+-------------+------------+----------+-----------------+------+
| emp_id | emp_name    | department | designation | join_date  | salary   | email           | age  |
+--------+-------------+------------+-------------+------------+----------+-----------------+------+
|      4 | Sneha Patil | Finance    | Analyst     | 2019-07-25 | 70000.00 | sneha@gmail.com |   30 |
+--------+-------------+------------+-------------+------------+----------+-----------------+------+
1 row in set (0.00 sec)

mysql>
mysql> -- 15. Subquery (above average salary)
mysql> SELECT emp_name, salary
    -> FROM Employee
    -> WHERE salary > (SELECT AVG(salary) FROM Employee);
+-------------+----------+
| emp_name    | salary   |
+-------------+----------+
| Priya Singh | 75000.00 |
| Sneha Patil | 70000.00 |
+-------------+----------+
2 rows in set (0.00 sec)

mysql>


